{
  "schema_version": "1.0", "tool_version": "2.0.0-dev.1", "command": "process.list",
  "status": "error", "target": {"pid": null},
  "execution": {"command_accepted": true, "operation_completed": false, "outcome_verified": false},
  "data": null, "findings": [], "evidence": [],
  "errors": [{"category": "timeout", "stage": "query.deadline", "message": "The query deadline was exceeded.", "win32": null, "ntstatus": null, "verified": true}],
  "duration_ms": 0
}
