{
  "schema_version": "1.0", "tool_version": "2.0.0-dev.1", "command": "process.inspect",
  "status": "error", "target": {"pid": 4242},
  "execution": {"command_accepted": true, "operation_completed": false, "outcome_verified": false},
  "data": null, "findings": [], "evidence": [],
  "errors": [{"category": "access_denied", "stage": "OpenProcess", "message": "Access denied.", "win32": 5, "ntstatus": null, "verified": true}],
  "duration_ms": 1
}
